,artist_name,track_name,release_date,genre,lyrics,len,dating,violence,world/life,night/time,shake the audience,family/gospel,romantic,communication,obscene,music,movement/places,light/visual perceptions,family/spiritual,like/girls,sadness,feelings,danceability,loudness,acousticness,instrumentalness,valence,energy,topic,age
35925,rosanne cash,sea of heartbreak,2009,country,light harbor shine like lose ship adrift heartbreak lose loneliness memories caress divine wish dear tear heartbreak lose fail leave sail heartbreak lose loneliness memories caress divine wish dear tear heartbreak sail shore arm come rescue come away heartbreak lose loneliness memories caress divine wish dear tear heartbreak heartbreak lose loneliness memories caress divine wish dear tear heartbreak heartbreak heartbreak,60,0.0014619885131774,0.0014619883426394,0.001461988352106,0.0014619883162719,0.0014619883040937,0.0014619883043565,0.1335035399798208,0.0014619883250782,0.0014619883322012,0.0014619883510909,0.0014619883247637,0.2273302869989324,0.0014619883308742,0.0014619883957964,0.5031727235519589,0.0014619883061342,0.6079280840463556,0.7199189805912365,0.7479917148511194,2.520242914979757e-05,0.5599752679307503,0.567554061748475,sadness,0.1571428571428571
36315,zac brown band,where the boat leaves from / one love,2010,country,place boat leave take away problems worry drop blue ocean gotta away boat leave sand shade banana tree drink cold reggae know place away boat leave take away problems worry drop blue ocean gotta away boat leave problem perfectly good island ride float grab coat need go away boat leave take away problems worry drop blue ocean gotta away boat leave pick pick pick sand cool fall stool sleep till morning come ladies pina colodas songs play song want hear soft tropical lips singin away boat leave take away problems worry drop blue ocean gotta away boat leave away boat leave take away problems worry drop blue ocean gotta away away boat leave take away problems worry drop blue ocean gotta away boat leave pick pick gotta pick pick,129,0.0005159958893593,0.0005159958895796,0.0005159958806024,0.0005159958854218,0.0005159959329167,0.0579673359181036,0.014153643897905,0.000515995891343,0.0005159959160029,0.1199326996182385,0.2819174629083815,0.0005159959020086,0.0005159958780424,0.0005159958797325,0.3280271650190104,0.0005159959182685,0.4703779919852703,0.7548650103838166,0.1224890788042959,0.0,0.7207337180544104,0.8378327731556782,sadness,0.1428571428571428
36825,krizz kaliko,damage (feat. snow tha product),2012,country,wrong kill motherfucker yeah wrong feel fuck disrespect fuck fuck kill people rid go fuck shit fight break light slow life know life span sleep step dig join jeffer pretend number contender juice like blender bust crime offender open tender proper referee legacy best best guess guess break sixteen clean miss thing glisten pristine listen damage damage damage difficult booin cause ruin damage damage damage damage damage difficult booin cause ruin damage look snow white step bitch sit finna fuck dead mexican wreckin like drink truck say best statement question fuck say habitual liar comin shit luck come damage like understand hard decode eye play possibly crazy nut monstrosities constantly mind bitch damage average kill sammich spittin spanish mami anda cien ahora contra compra mato mato friends damage damage damage difficult booin cause ruin damage damage damage damage damage difficult booin cause ruin damage people people evil people evil peep leave steeple mean bust little tryna vittles lunch goin think sequel genius wasn equal people see teekel leakin get beat repeatedly repeat frequency guess speak damage damage damage difficult booin cause ruin damage damage damage damage damage difficult booin cause ruin damage,192,0.0005599104297766,0.1531036588131129,0.0005599104729115,0.0005599104379597,0.0116486565866922,0.0113498702364296,0.0005599104187655,0.2317940604046636,0.4632561291607519,0.0005599104513076,0.056334523722383,0.000559910468592,0.0377356409558972,0.0005599104399857,0.0005599104409984,0.0286184452660507,0.5613560056319723,0.801810117170474,0.3514049712901318,0.0,0.7938994229183842,0.9069039994041854,obscene,0.1142857142857142
37177,alan jackson,there is power in the blood,2013,country,free burden power blood power blood evil victory wonderful power blood power power wonderworking power blood power power wonderworking power precious blood free passion pride power blood power blood come cleanse calvary tide wonderful power blood whiter whiter snow power blood power blood stain lose lifegiving flow wonderful power blood,50,0.0015037594690568,0.495086711104275,0.0015037594155021,0.001503759400251,0.0015037593984963,0.0015037593985555,0.0015037593984963,0.0015037594015943,0.001503759431913,0.0015037594858746,0.0015037594099514,0.0015037594429265,0.0832194758881496,0.0015037593984963,0.0015037594073201,0.0015037593984963,0.7498104624715695,0.662590057175089,0.5722887271975173,3.0263157894736843e-06,0.6712695795548227,0.413395093019922,violence,0.1
37492,kenny chesney,coconut tree (with willie nelson),2013,country,eye indispose disguise know hide face lie snake disgrace boil heat summer stench neath black look dead cream hear scream black hole come away rain black hole come come come stutter cold damp steal warm wind tire friend time go honest long snake shoe walk sleep youth pray heaven send hell away sing like anymore black hole come away rain black hole come come black hole come away rain black hole come come black hole black hole come black hole black hole come black hole black hole come black hole black hole hang head drown fear till disappear black hole come away rain black hole come come black hole come away rain black hole come come black hole black hole come black hole black hole come black hole black hole come black hole black hole come black hole black hole come black hole black hole come come,147,0.1459451324903821,0.6851655421323114,0.0003898635607819,0.010173678592586,0.000389863548166,0.0003898635516231,0.0003898635599801,0.0003898635845104,0.0003898635571513,0.053678536161938,0.0003898635846406,0.0003898635670908,0.0003898635612524,0.0003898635614165,0.0650906319901646,0.0003898635683003,0.8267085454348533,0.6485911340153321,0.7590359026464886,0.0001730769230769,0.7938994229183842,0.3873682541436729,violence,0.1
38593,langhorne slim,sea of love,2016,country,know bear good shin feel build boat sail swear fail sail hand swim clothe watch wave water rise build boat sail swear fail sail hand know bear good shin feel build boat sail swear fail tear hand,37,0.0015037594183183,0.363431726987142,0.0015037594329244,0.0015037594108069,0.0015037594045153,0.0015037594294087,0.0015037594680596,0.0737533073399639,0.001503759458928,0.0015037594023661,0.0015037595018291,0.1399653700195789,0.0608427083473275,0.0015037594700401,0.0015037594987002,0.12181073712826,0.5158669988086212,0.6377458144245314,0.9076304293478208,0.0006204453441295,0.3013190436933223,0.2722495437294938,violence,0.0571428571428571
39400,caylee hammack,family tree,2019,country,sister smoke camels county week clean sneak smell like nocotine momma burn chicken tupperware party tonight daddy asleep chair blare stats halftime whoaohohohoh real life real funny whoaohohohoh money sing little higher hang want stay home matter cause root deep gonna shake family tree whoaohohohoh whoaohohohoh grandma sell maytag dryer post uncle bail hang laundry till snow hell cousins like sunday drive roll luck lunch high school high whoaohohohoh real life real funny whoaohohohoh money sing little higher hang want stay home matter cause root deep gonna shake family tree gonna shake family tree whoaohohohoh whoaohohohoh problems everybody alright plan plan gettin problems hell sing little higher hang want stay home matter cause root deep gonna shake family tree gonna shake family tree whoaohohohoh real life real funny whoaohohohoh money gonna shake family tree whoaohohohoh root deep whoaohohohoh nothin nothin gonna shake gonna shake family tree,146,0.0004873294388586,0.0004873294557675,0.0347986068375749,0.0206513099578545,0.0004873294556776,0.1007240092658711,0.0004873294374336,0.0004873294517947,0.3434731520285855,0.0625401473375905,0.0956493963698743,0.0725249111297978,0.1226084147920494,0.0091787509658246,0.0004873294584169,0.0004873294697437,0.67507852269035,0.7959900520472784,0.015360457189214,0.0021356275303643,0.531121187139324,0.8548503216516872,obscene,0.0142857142857142
39770,ella fitzgerald,between the devil and the deep blue sea,1953,blues,want hate lose devil deep blue forgive cause forget devil deep blue oughta cross list come knockin door fate heart twist come run hate guess devil deep blue oughta cross list come knockin door fate heart twist come run hate guess scat interlude devil deep blue,46,0.0746986538121419,0.473511695833942,0.0013495277499137,0.0013495276814988,0.0013495276709949,0.0013495276684066,0.0013495276730203,0.00134952778898,0.0013495277117807,0.1220204593666706,0.0013495277133104,0.0013495276833994,0.0013495276696009,0.0013495276755299,0.2815332052602421,0.001349527666981,0.4779594931224954,0.7954516319257492,0.7630519709357139,0.0,0.832028029678483,0.4674508353013627,violence,0.9571428571428572
40047,aretha franklin,he will wash you white as snow,1956,blues,accord unfailing accord great compassion blot transgressions accord unfailing accord great compassion blot transgressions create clean heart restore salvation create clean heart restore salvation sacrifice break contrite heart sin sacrifice break contrite heart sin create clean heart restore salvation create clean heart restore salvation white snow white snow white snow white snow create clean heart restore salvation create clean heart restore salvation,62,0.0019493177387916,0.4035087017782397,0.001949317743075,0.001949317738803,0.0019493177388138,0.0019493177483904,0.0019493177745962,0.0019493177387916,0.0019493177737232,0.1178414355942615,0.0019493178151199,0.0019493177782554,0.0872912368344949,0.0019493177387916,0.3621188595106851,0.0019493177387916,0.4844579226686885,0.7661461938825218,0.9899598292769372,6.427125506072874e-05,0.6022258862324814,0.5315169002275146,violence,0.9142857142857144
40312,woody guthrie,put your finger in the air,1958,blues,finger finger finger hold right finger finger cheek cheek finger cheek cheek finger cheek leave week finger cheek cheek finger nose nose finger nose nose finger nose grow finger nose nose finger finger finger leave year finger finger finger finger finger finger finger finger finger leave linger finger finger finger,50,0.0014619883231705,0.881323824015958,0.0014619883533745,0.0014619884510232,0.0014619883216584,0.0014619883193493,0.0014619885854933,0.0014619883438233,0.001461988374302,0.0014619884239438,0.0938223739217098,0.0014619883217029,0.001461988309367,0.0014619883397179,0.0014619883760386,0.0014619883044947,0.539694573811329,0.5222931569366458,0.9869477780600182,0.4635627530364372,0.6259274525968672,0.200175220687573,violence,0.8857142857142857
41743,nina simone,july tree,1965,blues,true seed autumn grind true seed autumn grind true deep winter white snow true deep winter white snow long grow know true bud know true bud fair true bloom world true bloom world bloom high july tree,37,0.0018796992965522,0.0941280517824268,0.1008091967864697,0.0018796993633728,0.0018796992619916,0.0018796992851157,0.3356732673279413,0.0018796994613443,0.0018796992943301,0.1172188134405452,0.0018796993101923,0.3258548802960769,0.0018796992952446,0.0018796992939784,0.0018796993385067,0.0018796992566102,0.2992526806021878,0.5662384944747839,0.9327308561554782,0.0046356275303643,0.1714756801319043,0.184158704456035,romantic,0.7857142857142857
42395,status quo,ice in the sun,1968,blues,little live love touch underneath floor like melt away come melt away like melt away chair read book couldn care room look like melt away come melt away like melt away open eye speak look weak eye bigger think anymore like melt away come melt away like melt away like melt away come melt away like melt away,58,0.0746469157734983,0.1339891704008619,0.0011695908407275,0.0011695906528393,0.0011695906432956,0.0226599341530868,0.040776426085492,0.0011695907264358,0.0011695906761619,0.0011695906753322,0.0011695907107715,0.0011695907125619,0.0011695906732114,0.2639576689714191,0.4487652057186813,0.0011695906454478,0.339326329470378,0.8172961054277875,0.0010632540795723,0.0,0.7938994229183842,0.7167078691546722,sadness,0.7428571428571429
42666,steppenwolf,power play,1969,blues,word music give right stand tell tell give power stop livin like remember plan stay away bite hand feed time like clever lie tire freeze smile voice gang turn knob remember plan stay away bite hand feed end power play grind like giant millstones tween jealous greed vicious hate fate time head know awake dark know longer blind breakin strangle hold mind need cross street careful pushin round obsolete remember plan stay away bite hand feed music right control administer corporation america,82,0.0008354219040934,0.3426177955781914,0.1762973870651945,0.0881385988933041,0.0008354219524461,0.0008354219117596,0.0008354219768761,0.0899859816766697,0.0008354219620644,0.0584962970652184,0.0369478323474743,0.0008354219309452,0.0008354219012762,0.0326538034299248,0.1278730711255456,0.0008354218898901,0.4064767681143725,0.5843396661795246,0.6275096661743637,0.000408906882591,0.5280296784830998,0.6516407719640491,violence,0.7285714285714285
43235,jeff beck,ice cream cakes,1972,blues,cream cake lollipops babe sweet cream cake lollipops babe sweet nice love somebody somebody like yeah lord tell lips taste romance drive babe gonna share nice love somebody somebody like burnin desire soul know fill lord guess wanna girl woah woah cream cake lollipops baby sweet cream cake lollipops babe sweet nice love somebody somebody like yeah yeah,58,0.1475389998879653,0.0011961722882276,0.0011961722895088,0.001196172250788,0.0707444231159062,0.0501767623446278,0.3204111425247404,0.0011961724809439,0.0011961723049096,0.0011961722704041,0.0011961723200441,0.0011961722767925,0.0011961722629377,0.2086901402615972,0.0011961723111095,0.1399428218224013,0.3869814794757933,0.6637950926851779,0.2018064275164935,0.0224696356275303,0.7805028854080791,0.7026934174520766,romantic,0.6857142857142857
43315,aretha franklin,first snow in kokomo,1972,blues,snow kokomo indiana highway kokomo funny friend name slip bump head ooooops pick ask nose turn snow kokomo learn blow horn feel right snow kokomo play bass learn play applegate discover coronet right away expect baby kinda blue snow kokomo bass away away wonder applegate learn play blow horn baby name bear pretty little baby get ready things right right snow snow kokomo snow kokomo snow kokomo,67,0.0712930974955741,0.0011198208713358,0.0556965026222941,0.1083938883821328,0.0011198208385231,0.0011198210460183,0.0011198208288442,0.0011198209267507,0.0011198208750252,0.3273182606062214,0.3190299188415777,0.0011198208808699,0.0011198209871587,0.0011198209036714,0.1037106603362795,0.0011198210550229,0.4443842738004983,0.5448811629874625,0.9688754707585048,1.2246963562753035e-06,0.1622011541632316,0.0745456714964471,music,0.6857142857142857
43581,blue yster cult,baby ice dog,1973,blues,bitch lie deceit give chill baby baby say mongolian country lilies shoot free astoning mountains intent clear clear cave numb assist baby go cold cold cold grind say baby break turn like break hound cross bind lower station cross baby cross baby ladies fear mongolian face know involve unnatural act cold cold stare like black know know like come mind freeze baby freeze freeze freeze bone bone freeze freeze freeze freeze freeze freeze bone freeze freeze freeze freeze,78,0.172072463012486,0.6848224164651974,0.0008354219126339,0.0008354219060552,0.0008354218953834,0.000835421895834,0.000835421897689,0.000835421976047,0.0644742644715837,0.0008354219063051,0.0491670281755028,0.0008354219175686,0.0177679209964493,0.0008354219716329,0.0008354219275058,0.0008354219893733,0.5386115022202967,0.6982027023562289,0.072589430310673,1.2955465587044532e-05,0.6908491343775762,0.6746645140468851,violence,0.6714285714285714
43833,jethro tull,skating away (on the thin ice of the new day),1974,blues,year belong stand pant undo cause breed humanity sell society present million generations remove expectations want skate away skate away skate away push shore turn head peace choose stay live things cross wilderness spin emptiness pray look sign universal mind write passion play skate away skate away skate away cross circle line wall creak rabbit silver splinter corner shin set feel story damn real present tense everybody stage like person sit audience skate away skate away skate away skate away skate away skate away,84,0.0010319917456116,0.1552984577036729,0.135327343287753,0.0010319918252296,0.0010319918792269,0.0010319917592434,0.0010319917458189,0.0010319917958503,0.1513204836207674,0.0010319918518601,0.0010319918326295,0.1362083555515084,0.00103199188853,0.0010319917984586,0.3831700924189508,0.001031991836449,0.3599046896999892,0.5467528138861113,0.2620474518548714,0.0,0.7073371805441054,0.3673476088542505,sadness,0.6571428571428571
45022,jethro tull,north sea oil,1979,blues,black viscousbound cure blue lethargy sugarplum petroleum energy payments need small reprieve believe want north north newfound wealth sit shelf yesterday hotair balloon inflation soon riggers diggers shallow grave save crave north north price boom aberdeen london years fear erase frown nuclearthe better pray want stay north north north,49,0.0029239766327612,0.1878994746673714,0.5295406785026389,0.0029239767329549,0.0029239771428053,0.0029239766825176,0.0029239766246098,0.002923976773991,0.0029239767197628,0.1164002440648343,0.0029239768966659,0.002923976666893,0.0029239766626593,0.0029239766083441,0.0029239767347454,0.0029239766094669,0.6122603704104842,0.6767428146552829,0.0141556367024464,5.607287449392713e-06,0.8866446826051113,0.7717646437005838,world/life,0.5857142857142857
45874,slade,keep your hands off my power supply,1983,blues,driver state need relieve blue light flash comin aright hittin cat eye try hard follow white line ready face huntin sure maybe want autograph hand power supply away hand guess white inceptor maybe flag boys blue nose grind watch licence ready blow ready lose gotta work gonna hand power supply away hand guess gotta away ready face huntin sure better leave gear stick hand power supply away hand guess gotta away gotta away,73,0.0009074410231823,0.3055188958946646,0.0009074410393883,0.0879947173780573,0.0009074410955786,0.0009074411181191,0.0009074410765827,0.1296446709048898,0.1161851889301024,0.0388618477955961,0.0508905444015005,0.0009074411396392,0.0009074410491375,0.0009074410304427,0.1645491944778356,0.0009074410238299,0.2678436044622549,0.7329436197215597,0.0206817476724374,8.502024291497975e-05,0.2333058532563891,0.9299277414870214,violence,0.5285714285714286
46626,albert collins,bending like a willow tree,1986,blues,bend break good advise little late nothin trouble yeah know bendin knee weepin bendin like tree lyin fake tell look face sooner later gotta break bendin knee weep bendin like tree like bitter pill beggin baby late goodness sakes break little bendin knee weepin bendin like tree,47,0.042861888350307,0.0018796993357156,0.0018796992803383,0.060256628988674,0.0408187903895942,0.0807444608497052,0.0018796992577269,0.0018796994108696,0.3225095456522295,0.0018796992801802,0.0018796993710428,0.001879699358079,0.147424105245931,0.1707809606078519,0.0898162747729459,0.0259903518925719,0.7032383840571862,0.5755198318078096,0.422690183423879,0.1427125506072874,0.9000412201154163,0.5915788360957819,obscene,0.4857142857142857
48098,robert plant,down to the sea,1993,blues,wait want come watch ship pass friendships small ship hardships dream want come head sand life passin days see tear laughter dream movin wave ocean life tambourine shake better wisdom word head sand days passin older settle come,38,0.0017543861573671,0.0899020929444444,0.3633468490695771,0.0017543860306441,0.0017543859649243,0.0017543859688717,0.0017543859761291,0.0017543860317349,0.0017543860384335,0.0017543860317005,0.0017543860487922,0.408226281085651,0.0405351061885164,0.0017543859713362,0.0017543861319794,0.0017543859657112,0.4844579226686885,0.7024331461682434,0.0129508162156789,0.0064878542510121,0.3610882110469909,0.7687615469071706,world/life,0.3857142857142857
48178,ella fitzgerald,let it snow! let it snow! let it snow!,1993,blues,weather outside frightful delightful place snow snow snow sign stop buy corn pop light turn snow snow snow finally kiss goodnight hate go hold tight home warm slowly die dear goodbying long snow snow snow finally kiss goodnight hate go hold tight home warm weather outside frightful delightful place snow snow snow sign stop buy corn pop light turn snow snow snow finally kiss goodnight hate go hold tight home warm slowly die dear goodbying long snow snow snow,79,0.0007855459558235,0.1269852476342146,0.000785545994189,0.000785546006812,0.0007855459545417,0.0007855459583937,0.1848717880880259,0.0007855459836214,0.000785545980953,0.546106359417822,0.0007855460213026,0.0942644138118027,0.00078554596972,0.0007855459569107,0.0007855459905188,0.0007855460240122,0.3826491931116647,0.6697177140219983,0.8092367562618035,0.0,0.8526380873866446,0.4143961252843932,music,0.3857142857142857
48199,phish,it's ice,1993,blues,press elastic sheet breathe slice worm serpents bubble source invisible everpresent voice skate legs trace different shape choice mimic image radiance bask tie depend reluctantly reflections tumble slide wrong skin fall crack plunge join meet eye surprise laugh light frown double want pull slip friction slide skin peel bone flesh leave mirror image moment soul lean time attack control hand time throw punch block defeat sulk squirm freeze heights wait calculate till venture,73,0.0015948963400376,0.549708311216232,0.001594896496834,0.1727111170759391,0.0015948963621902,0.001594896336027,0.0015948964789515,0.0015948964439329,0.0818205741888201,0.0015948963618452,0.00159489645188,0.1404573287755595,0.0015948963548908,0.0015948963720104,0.0015948964878957,0.0015948963437354,0.5212823567637821,0.6669743353075404,0.2188747177457005,0.0278340080971659,0.3786067600989283,0.7907842567255353,violence,0.3857142857142857
49708,j.j. cale,river boat song,2001,blues,cale hear whistle hear moan baby come home tupelo sing river boat song dancer river queen teach gamblers tupelo sing river boat song nights spend days home time wish yeah river boat whistle blow know get near river captain bring baby home lonesome go tupelo work river boat song nights spend days home time wish yeah river boat whistle blow know get near river captain bring baby home lonesome go tupelo work river boat song,75,0.0784587945849764,0.0009233610547074,0.0009233611081396,0.090966516958641,0.0387552042361698,0.045197178609584,0.0009233610579408,0.0009233611157143,0.0009233610737831,0.5132060289745879,0.0009233610887914,0.0009233610460758,0.0009233610490169,0.0235826124427749,0.0009233610773174,0.0009233611105615,0.6555832340517709,0.6928954183011562,0.6817265880789039,0.7125506072874495,0.5950123660346248,0.412394060755451,music,0.2714285714285714
50202,widespread panic,thin air (smells like mississippi),2004,blues,drivin walkin rain stream windowpane field water stir sleep holdin tight dreamin feel like mississippi high tractor workin dirt moon trade place better plow away yeah momma stickin story happen war walkin funny cause shoot local feel like mississippi feel like mississippi belly boys favorite learn paint come guitars talk string lord beat drum turkey goin mississippi,57,0.001422475174706,0.0014224752067257,0.0014224752397426,0.0014224751771502,0.0289777642007166,0.0354723866716929,0.0014224752111303,0.0014224752511591,0.3776483332070938,0.0014224752365689,0.2576707107948006,0.1444181829054973,0.0014224751136443,0.0014224752506301,0.0014224752882332,0.077675829457278,0.3729015487923752,0.7116119272876444,0.3845375346762396,0.1032388663967611,0.8227535037098105,0.779772901816353,obscene,0.2285714285714285
50402,cab calloway,between the devil and the deep blue sea,2004,blues,want hate lose inbetween devil deep blue forgive cause forget inbetween devil deep blue ought cross list come knock door fate heart twist come run hate guess inbetween devil deep blue,31,0.0019493179519921,0.5060282728380265,0.0019493178994312,0.0019493177638113,0.0019493177513903,0.0019493177443783,0.0019493177489259,0.0019493179091937,0.0019493178139729,0.138132977725769,0.0019493178042173,0.0019493177695229,0.0019493177481312,0.00194931775824,0.2819597488382328,0.0019493177424834,0.5970973681360339,0.6043381278363202,0.9738955561200364,0.0001042510121457,0.6723000824402307,0.2582350920268981,violence,0.2285714285714285
51496,mountain,beside the sea,2009,blues,place mountains right base stream water fountains cold endless breeze temperature minus degrees snow peak sunset oblique polar bear speak gather midweek colourful contrast winter overcast season pass island fast past happen world avast,34,0.0035087719521688,0.0035087722757787,0.3252308885333584,0.07144918335517,0.0035087719824721,0.003508771929825,0.0035087719673951,0.0035087722312112,0.0035087720312267,0.3121929052332204,0.003508772117633,0.0035087721638797,0.0846208841548501,0.0035087719648688,0.0035087720452183,0.003508771933126,0.2082746669554858,0.5735969028023484,0.4508026614484553,3.603238866396761e-06,0.5558532563891178,0.5245096743762168,world/life,0.1571428571428571
