,artist_name,track_name,release_date,genre,lyrics,len,dating,violence,world/life,night/time,shake the audience,family/gospel,romantic,communication,obscene,music,movement/places,light/visual perceptions,family/spiritual,like/girls,sadness,feelings,danceability,loudness,acousticness,instrumentalness,valence,energy,topic,age
12505,raekwon,"ice cream (feat. ghostface killah, method man & cappadonna)",1995,pop,tracklist hooch khaled tourist esco sauce future vert partynextdoor gucci mane pussy print kanye hooch good music champion quavo gucci mane gotti desiigner young thug pick phone quavo quavo cuff partynextdoor kodak black like hoe madeintyo uber khaled key jayz future savage future pusha drug dealers anonymous jayz young ooouuu hood mode schoolboy muir khalid location tame impala eventually boogie hoodie shit khaled work gucci mane chainz vert seven million future dram cute gucci mane guwop home young thug usher limit remix savage heart luxury pints bricks timeless light friends iver kamaiyah feel brazy miller dang anderson paak bieber company partynextdoor buzzin yachty drama boyz hood meek pusha dolla snake quavo gsha key common remix kanye wutang clan cream ghostface killah mighty healthy kanye appal cyhi prynce swizz beatz pusha kanye flow ghostface killah pusha kanye heartless kanye good friday pusha cudi common raekwon cream ghostface killah method cappadonna method need blige root saadiq root respondreact root dynamite kanye hours tribe call quest butter tribe call quest tribe call quest sucka nigga rapper action wutang clan wutang clan nuthing fuck bieber runaway remix raekwon kanye hooch,186,0.0015948963425945,0.0015948964665955,0.133888922475494,0.0015948964015179,0.0015948965629362,0.0015948964503545,0.0015948963821938,0.001594896388658,0.366087335528255,0.1659749846474657,0.0015948964405937,0.001594896756686,0.1896469384050287,0.0015948963873075,0.0370817457062515,0.0865864196054148,0.6729123795082855,0.7247647616849986,0.2198787348180068,0.0007702429149797,0.7217642209398186,0.902899870346301,obscene,0.3571428571428571
13308,phish,wading in the velvet sea,1998,pop,take moment wrap things mail address soon package begin break point try toss like thoughts time leak life leak moments clock take moment wrap things mail,26,0.0027700831027822,0.0027700833497263,0.5168678857638731,0.1009387189805931,0.0027700831025456,0.0027700831197756,0.0861221297750132,0.0027700832752259,0.0027700832182175,0.0027700832333972,0.0027700832555595,0.0027700832278187,0.0027700831203215,0.0596968994426983,0.1975932016079423,0.0027700831068078,0.423805913570887,0.6659744122247006,0.598393171077481,0.361336032388664,0.2941055234954658,0.5134983194670344,world/life,0.3142857142857143
13408,madonna,the power of good-bye,1998,pop,heart open spell break love freedom come learn creation come learn lesson learn fortress burn pain warn wrong pray long wanna higher leave place leave hide greater power power goodbye heart open spell break love lesson learn fortress leave lose heart bruise greater power power goodbye learn goodbye yearn goodbye leave place leave hide greater power power goodbye leave lose heart bruise greater power power goodbye,66,0.0009930488072064,0.0009930487088246,0.1108432730204368,0.0009930487801191,0.0009930486593898,0.0009930486809909,0.1726519858459455,0.0009930487242599,0.0009930486699376,0.0009930486973627,0.0009930486866108,0.0420025716557232,0.0292640392287473,0.0009930486597297,0.4311341039084666,0.0009930486862958,0.5115347124444927,0.62990026408225,0.044376550578866,0.6862348178137652,0.2013602638087386,0.5615478681616483,sadness,0.3142857142857143
14624,transplants,tall cans in the air,2002,pop,hurt look baby yeah crew ugly game money show honey funny hate fuckin gut time gold lowrinding bike catch hatin know like chillin smokin chronic chokin stress tall can fuck tall can fuck fact pocket stay cash whack cocaine sack crew roll lack wish come flat better fuckin miss drinkin whiskey know diablo past tipsy drink high sober yeah talk head tread joker sing shout come clean forever doubt like machine trigger better watch yeah transplant fuck come original style say fuck distillers lasalle transplant fearless original think fuck better think twice thugs wolfpack nice check date time lyrically commit hate crimes noose cord hang time blow mind rhyme design break spike transplant comin kind chrome dome flip like flapjack tall can packet blackjack,124,0.0386820231969306,0.0007518797387746,0.000751879733234,0.0291941546806814,0.0443239042546835,0.0007518797021147,0.0007518797069427,0.1344473689708722,0.5609301364592251,0.0180231795280175,0.1509949169517805,0.0007518797196815,0.0007518797085055,0.0007518797588106,0.0007518797484451,0.0007518797441365,0.5299469294920395,0.8594467092274952,0.0131516196301401,0.0,0.5888293487221763,0.9389370318672614,obscene,0.2571428571428571
15312,coldplay,swallowed in the sea,2005,pop,tree bring go wrong shelf keep blame blame write song long belong belong write spread lose swallow line hang darling decide size open eye realize write book shake world take take write spread lose come swallow write song long belong belong streets walk thousand house long belong belong good live leave forget forgive love streets walk thousand house long belong belong swallow belong swallow yeah belong swallow,67,0.0008628127876649,0.0008628128263243,0.119921553109042,0.0568223915318148,0.0174379669906685,0.0008628127830902,0.0390569991366653,0.0008628128059296,0.000862812799665,0.3811523907182619,0.0880169718243171,0.0440693404182612,0.0267657586997729,0.0008628127773308,0.2006787027633868,0.018312609646469,0.2472652442326438,0.6367202522882854,0.0559227469103884,1.305668016194332e-06,0.1333470733718054,0.3783589637634327,music,0.2142857142857142
16012,pinback,good to sea,2007,pop,move earth outside grind shake like beat dense terrible sound teem asleep sign believe situation best good good good good kind terrorize sleep try probably deep fine feet ideas meet good good good mind good think health good strange mind work good strange mind work good good mind good think health good strange mind work good strange mind work good strange mind work good strange mind work good strange mind work,71,0.0008354218900257,0.0464326455581011,0.0008354219260347,0.175475875837689,0.0008354218889796,0.1104534249719494,0.0008354218978753,0.1379094075140208,0.0008354219304874,0.0008354219483117,0.0008354219422386,0.0008354219262806,0.1564856791947405,0.0008354219853082,0.0008354219141626,0.3016793327241522,0.7714718942922129,0.7130477142783888,0.5030115492083829,0.0005334008097165,0.9319868095630668,0.7767698050229395,feelings,0.1857142857142857
16590,twenty one pilots,air catcher,2009,pop,fall slow like fall straight steal catcher keep safe sound parachute safely grind cord work star fall fall avoid eye think beat moon pretty contest moon happen thing miss fine wasn lack steal catcher know want fall fall avoid eye cause sure want tool destroy heart wanna hear write fear believe talk breathe fall selfishly fall fall avoid eye word tool destroy heart,63,0.0010741138670861,0.0010741139467251,0.0010741138978107,0.0010741138889841,0.0010741138604122,0.0151044216420997,0.0010741138805407,0.2105536873906862,0.0010741139262911,0.0462941359656332,0.0010741139030727,0.114493442077813,0.001074113858166,0.0663421863405626,0.4387841246481237,0.001074114027771,0.4952886385790102,0.7074584006358484,0.073392643968518,0.0,0.1127370156636438,0.4364188351027578,sadness,0.1571428571428571
16634,keri hilson,energy,2009,pop,uhoh yeah wish memory cause energy phase cause kill rewrite history mystery hard believe lonely chance fade run suppose have nightmares sleep enemy reverse chemistry want take energy energy energy energy energy take energy energy energy energy energy take energy like yesterday gravity feet grind divide hide misery mystery hard believe lonely chance fade run suppose have nightmares sleep enemy reverse chemistry want take energy energy energy energy energy take energy energy energy energy energy take feel change afford slip person mean whoa afraid walk give move get deep cause take energy have nightmares sleep enemy reverse chemistry want take energy have nightmares sleep enemy reverse chemistry want take energy energy energy energy energy take energy energy energy energy energy take kill take yeah take energy,126,0.0008223684249969,0.0853220563169172,0.0531169668208845,0.1272200148854033,0.0513161884804333,0.0008223684430664,0.0008223684307678,0.0008223684922025,0.0008223684587001,0.0008223684248607,0.0008223684718001,0.000822368441887,0.000822368438113,0.0008223684703674,0.5723459841245025,0.0008223684494418,0.3837322647026969,0.7688382944901674,0.0920673615134151,0.0,0.5960428689200329,0.7827759986097663,sadness,0.1571428571428571
16845,twenty one pilots,march to the sea,2009,pop,land die step die breath fall line stranger feet look leave right fall line look anymore cause raindrop heaven forbid fall line time year line ocean walk right fall asleep near land ocean grave sand question fall line corner spaceship hear voice inside head follow instead follow instead follow instead follow wag start inside head counterpart emotionless marchers chant phrase line start sand eye focus land voice inside head say follow instead follow instead follow follow instead follow instead follow instead follow instead follow instead seal door want march anymore realize line dead follow instead place start march,98,0.000619195050593,0.6852737786354192,0.0006191950786178,0.0606290265346869,0.0006191950510182,0.000619195050268,0.0006191950536724,0.0006191950902659,0.0006191950704097,0.0006191951234653,0.0301031156246745,0.060709964935322,0.0006191951278648,0.0006191950660222,0.1411326139578705,0.0006191950475665,0.6837430954186072,0.6540778914442478,0.4748990711838064,1.153846153846154e-05,0.1292250618301731,0.4964807709710252,violence,0.1571428571428571
17616,the lumineers,dead sea,2012,pop,stand platform vain puerto ricans play salsa rain open doors manual lock fast food park lot head york lie need truth need somebody need trust gamble like dead tell like dead sink lord like dead whoa like dead finest word say lyric commercial,43,0.001644736856363,0.3954015104439199,0.0016447369028644,0.0016447368459417,0.1290073378665598,0.035291179039206,0.0016447368528329,0.070971396929233,0.0016447370314726,0.0016447372891617,0.061880430068922,0.0016447368898268,0.0016447368463921,0.1202618171406792,0.0016447369301846,0.0333403285697154,0.7054045272392505,0.6296438735481885,0.8132528245510288,5.779352226720648e-06,0.4620774938169827,0.3192980601596366,violence,0.1142857142857142
18034,kid ink,money and the power,2013,pop,money power want cause money power want cause go hard long drop morning poppin wanna roll roll away dream dreamin bout gold tell wanna shine gotta scene walk right door nigga repeat double flow vibrate build ring phone wait smoke clear fall goin hard tictac tacky motherfuckers life bitch bitch go hard long yeah drop morning go hard long go hard long mamoney power little wanna cause ready ready tell bring level high phone foes cause dough fold forget plan leavin close close barely grind team everybody look like parade come hand feet grind stop party fund pray loud burnin rubber need slow go hard long yeah drop morning go hard long go hard long mamoney power little wanna cause monmoney power little wanna monmoney power little wanna fuckin know go bottle hand pocket dough go hard long yeah drop morning go hard long go hard long,147,0.0004244482332691,0.0004244482505301,0.0004244482743178,0.1223814750999944,0.0384897410172426,0.1284961373138884,0.0004244482379738,0.0004244482431108,0.3069891095615939,0.0004244482439215,0.0568834887212034,0.0425863770000353,0.0004244482284167,0.0004244482338542,0.0261331712672359,0.1123780966007406,0.5451099317664898,0.7662743891495525,0.0272078586424283,7.783400809716599e-05,0.3394476504534212,0.6836738044271251,obscene,0.1
18693,tyga,ice cream man,2015,pop,like fuck suck suck fuck cream chunky monkey like fuck suck suck fuck cream chunky monkey like twirly swirly vanilla coupe like sugar cone seat take roof marshmallow booty like sprinkle cream song ridin like fuck suck suck fuck cream chunky monkey cream chunky monkey money hungry hungry hippos wanna diamonds clear giuseppes shit ugly ghetto gutter sugar butter mama brother yeah hustler wanna fuck suck rush cream ball summer boys wanna cool cause need runners tell condoms doin fuckin like fuck suck suck fuck cream chunky monkey like fuck suck suck fuck cream chunky monkey like twirly swirly vanilla coupe like sugar cone seat take roof marshmallow booty like sprinkle cream song ridin banana clip bandana tie head bandana bread gettin like mode instagramming gold like fuck suck suck fuck giuseppes shit ugly saint paint ferrari baby lick caramel bath camo come army wanna fuck suck think sunday monday busy wednesday country club jumpin tell niggas bungie tell check number jumpin like fuck suck suck fuck cream chunky monkey like fuck suck suck fuck cream chunky monkey like twirly swirly vanilla coupe like sugar cone seat take roof marshmallow booty like sprinkle cream song ridin,196,0.0162005858547561,0.0005980861539247,0.0005980861329312,0.0005980861283283,0.0169521398844239,0.0172370420603919,0.0005980861290557,0.0005980861520935,0.6124156487408822,0.0518905032328631,0.0770106879199898,0.0005980861391522,0.0005980861790479,0.1115349677325501,0.0005980861418257,0.0005980861264205,0.9101050579443304,0.80975822372638,0.1676698470580793,0.0,0.3775762572135202,0.6706603849890006,obscene,0.0714285714285714
18820,drake,energy,2015,pop,lickwood mean rewind gunshot mean forward request rewind yeah turn yeah look enemies enemies people tryna drain energy tryna wave nigga fuckin pray nigga girls real life tryna fuck fuck goin online real shit poppin family niggas leave mortgage thirty million total niggas fuckin niggas gotta like like actin days fuck niggas life yeah enemies enemies people tryna drain energy tryna wave nigga fuckin pray nigga people talkin like fuck buy purse buy truck buy house buy mall buyin shit sure track bitch askin code wifi talk timeline picture friends tell friends exgirl female version strippers life virgins hear everybody talkin bout high hop niggas money court niggas free bout uber hear fairy tales bout enemies enemies people tryna drain energy tryna wave nigga fuckin pray nigga fuck niggas finish wanna hear wanna whoa real ones livin past road real ones tryna tell enemies enemies time somethin wrong memory tryna away nigga tire savin niggas mayne yeah enemies enemies people tryna drain energy tryna wave nigga fuckin pray nigga,169,0.0004537205107316,0.0004537205218261,0.1073933110031324,0.0004537205392141,0.0480301660426852,0.0004537205420051,0.0004537205100322,0.0004537205513368,0.735433258811258,0.000453720538994,0.0004537205439507,0.0004537205220226,0.0470816338724644,0.000453720527492,0.0166937033226607,0.0004537205288251,0.7378966749702156,0.7081250160244084,0.3303206127716995,0.0,0.5640972794723825,0.5715581908063595,obscene,0.0714285714285714
20047,gucci mane,ice (feat. gunna & lil baby),2019,pop,walk talk days days days think things forget time lover think risk days days days afraid live life song lose long days corner stone count time quarter tone friend believe want days corner stone count time quarter tone till friend confront failure aware,43,0.0014619883127133,0.0014619883651102,0.6099695650067227,0.0014619884596513,0.0014619883059887,0.001461988313782,0.0361611575930465,0.1154683123687343,0.0014619883331917,0.0354560890206141,0.1098666788528411,0.0014619883263395,0.0014619883068694,0.0014619883218685,0.0014619883704835,0.0014619883046298,0.8656991227120113,0.7732482116760249,0.1937742909380431,0.0,0.3713932399010717,0.5205055453183323,world/life,0.0142857142857142
20654,ray price,ice cold heart,1958,country,cold cold cold wish know like morning go away wonder dear gonna stay away pretty rainbow remind remember dear lips warm say awful cold cold heart instrumental morning go away wonder dear gonna stay away pretty rainbow remind remember dear lips warm say awful cold cold heart,47,0.001223990238433,0.0012239902824222,0.0012239902958252,0.0012239902362215,0.001223990221873,0.0012239902424655,0.3285896092968952,0.001223990345186,0.0012239902242247,0.0012239902747924,0.0012239903223195,0.0012239902413827,0.0012239902110246,0.0730793871787108,0.4494546180215085,0.0833929124887341,0.6100942272284199,0.6751788323975079,0.6606422295604715,0.0001012145748987,0.9361088211046992,0.4804642547394872,sadness,0.8857142857142857
20960,hank thompson,cryin' in the deep blue sea,1960,country,go baby say stay away cause wire flat tire alettin go look ocean cryin deep blue think baby goodbye go know card repeat leave weep moan nothin doggone blue flip walkin shoe repeat instead tear shed mornin tear shed night cry gosh baby sight repeat look ocean lord deep wide baby go hang little head cry repeat ocean cryin deep blue,61,0.0957965558744007,0.0010526316428686,0.0010526316053607,0.0384741664686087,0.0010526315838239,0.0693768949247121,0.0221922734277803,0.0010526316687366,0.111314924711273,0.0807178378909914,0.1232408022241688,0.0010526316468804,0.0010526315995338,0.001052631655862,0.3083065606491307,0.0538807069496168,0.7140690999675079,0.6503345896469501,0.871485814744794,0.0,0.81760098928277,0.7417336757664503,sadness,0.8571428571428571
21702,marty robbins,there's power in the blood,1963,country,free burden power blood power blood evil victory wonderfull power blood power power wonder work power blood power power wonder work power precious blood whiter wither snow power blood power blood stain lose life give flow flicker power blood power power wonder work power blood power power wonder work power precious blood service power blood power blood lift praise sing wonderfull power blood power power wonder work power blood power power wonder work power precious blood,76,0.0008223684219086,0.3283329869143714,0.0474670052859981,0.0008223684329142,0.0008223684210527,0.0924096869166116,0.0008223684225372,0.0803950857701197,0.0008223684869555,0.0260702933051211,0.0008223684295015,0.0008223685047421,0.0293543783018846,0.0008223684213333,0.0008223684418173,0.0008223684211238,0.7248998158778296,0.5690587903494602,0.3945777053993026,0.0,0.7495877988458366,0.4694528998303049,violence,0.8142857142857143
21703,marty robbins,the sea and me,1963,country,kees lonely company tide come go like tradewinds come someday think solitude hold away go moments dark beach secret randezvous brakers play sand bring home wind go moments dark beach secret randezvous brakers play sand bring home wind,38,0.0020242916682788,0.0020242915595338,0.0020242915768375,0.0020242915301344,0.002024291498885,0.0020242916134352,0.0020242918816047,0.0020242918175849,0.0020242915863705,0.3556296214031004,0.0020242915690033,0.341265017724982,0.0020242915066923,0.00202429168074,0.1831588246625281,0.0895821622004919,0.3696523340192786,0.5184985770325359,0.9176706000708836,0.0003522267206477,0.1683841714756801,0.1441174138771901,music,0.8142857142857143
23900,jonathan edwards,cold snow,1971,country,cold snow ablowin want stranger wake hours sleep hurry fasten boot strap baby pull wool shinin white cover grind shinin white cover grind sing write letter song song warm winter dream send cold time acomin know hear sound shin white cover grind shin white cover grind cold snow ablowin want stranger wake hours sleep hurry fasten boot strap mama pull wool shin white cover grind,65,0.0219173787937028,0.3810428437474397,0.0009930486871725,0.0237844049689297,0.0009930486641465,0.0202580789153649,0.0009930486844207,0.0009930487229644,0.0009930486811887,0.2469550265918039,0.1128160238279191,0.1422605377085789,0.0009930486942762,0.0009930486704388,0.0009930486961167,0.0009930486838198,0.5245315715368787,0.521806014921929,0.6777105197896787,0.0,0.6145919208573783,0.3913723832015574,violence,0.7
24739,the doobie brothers,daughters of the sea,1974,country,autumn breeze blowin east shift breeze peace hear hear sing hear voice ring dizzy dancin golden ladies eye fool silver shoreline wave come crashin like spider weavin silken net finger sway silhouette hear hear sing hear voice ring spin turn moonlit madness round burnin bright risin higher lightin starry night hear hear sing hear voice ring hear hear sing hear voice ring,62,0.001223990238754,0.0012239902756353,0.0012239902191135,0.0012239902284741,0.0012239902081663,0.0012239902081507,0.0012239902364127,0.001223990322318,0.0750113209193553,0.5986229860636477,0.0012239903018723,0.285354983542587,0.0226508556593187,0.001223990290648,0.0012239904123321,0.001223990209081,0.5061193544893319,0.5424454529138784,0.223894803107232,0.005910931174089,0.414674361088211,0.5935809006247241,music,0.6571428571428571
26210,barbara mandrell,love is thin ice,1979,country,easy fall right better know swim ready fallin better careful start callin advice better watch step hard read sign time lose fair care nice easy fall right better know swim ready fallin better careful start callin advice better stick higher grind want learn walkin thing know heart need repair cause easy fall right better know swim ready fallin better careful start callin advice better advice,65,0.001012145758395,0.0010121457981798,0.0010121457990438,0.1086150380603009,0.0010121458020921,0.0010121457893615,0.001012145762494,0.2628593608421222,0.3464908285388938,0.0010121457582778,0.0010121457829916,0.0302902927698616,0.0010121457530028,0.0010121457994463,0.1218822876023314,0.0010121457521197,0.7628073215639554,0.5998769325436504,0.3975897566162215,0.0,0.9649629018961252,0.5795664489221284,obscene,0.5857142857142857
27045,molly hatchet,power play,1981,country,gona feelin blue think lookin river dues reason ask cause power play like yesterday secondguessing shoot allow catch waitin talkin lie eye know miss cause power play know burn bridge good track waste time gona feelin blue think lookin river dues reason ask cause power play like yesterday secondguessing shoot allow cause power play know burn bridge good track waste time cause power play like yesterday secondguessing shoot allow cause power play know burn bridge good track waste time,79,0.0007518797050887,0.0007518797490328,0.0566250248867953,0.0730592272369179,0.0007518797049761,0.0007518797011448,0.0007518797034934,0.1661211087459198,0.3200412727790798,0.0702212516149882,0.000751879721707,0.0724813167553112,0.0007518797132949,0.0007518797358369,0.0007518797312628,0.066410631265697,0.539694573811329,0.6145937491987795,0.1686738641303856,0.1103238866396761,0.7753503709810387,0.7137047723612588,obscene,0.5571428571428572
28394,hank williams,at the first fall of snow,1985,country,talk stranger garment sackled tattered tear tell story sorrow heart go heaven fall snow speak dear baby girl love footstep love curl go heaven year angels come fall snow hold caress gaze whisper baby wait know bring fall snow listen eye fill tear know happier years frail body tremble speak soft baby fall snow pat shoulder feel hide couldn know cry inside smile part cause know lose baby fall snow,70,0.1089237285352613,0.0008920607199163,0.0008920607020804,0.000892060687811,0.0008920606641421,0.0008920606702759,0.1048285110261732,0.1229755950348291,0.0008920606824216,0.1885271354886479,0.000892060688599,0.0768549294290646,0.0008920606844587,0.0281740550637125,0.3590113170534523,0.0008920607847187,0.5970973681360339,0.5024998077070995,0.8825300025401633,0.0,0.3734542456718879,0.2051803820099286,sadness,0.5
32134,johnny cash,sea of heartbreak,1996,country,light harbour shine like lose ship adrift heartbreak lose loneliness memories caress divine wish dear tear heartbreak lose fail leave sail sail shore arm come rescue come away heartbreak,29,0.0025062660691681,0.0025062657589753,0.0025062657481415,0.0025062656879991,0.0025062656641606,0.0025062656648736,0.0775162001424568,0.0025062657115009,0.0025062657259342,0.0025062657412514,0.0025062657088841,0.4362345907090411,0.0025062657149358,0.0025062658706452,0.3471696274110783,0.0025062656687153,0.3003357521932199,0.7120734302489552,0.2329309567579887,1.902834008097166e-05,0.8917971970321517,0.5915788360957819,sadness,0.3428571428571428
33660,don gibson,sea of heartbreak,2001,country,light harbor shine like lose ship adrift yeah heartbreak lose loneliness memories caress divine wish dear tear heartbreak lose fail leave sail yeah heartbreak lose loneliness memories caress divine wish dear tear heartbreak sail shore arm come rescue come away yeah heartbreak lose loneliness memories caress divine wish dear tear heartbreak heartbreak yeah heartbreak heartbreak heartbreak,56,0.0015037596236235,0.0015037594417881,0.0015037594484361,0.0015037594114151,0.1157894736855792,0.001503759398797,0.1079168007791277,0.0015037594214915,0.0015037594297296,0.0015037594469868,0.0015037594211442,0.2402742305686411,0.0015037594267244,0.0015037595013931,0.4167594562286957,0.0015037594007768,0.572186721542294,0.6794092762095223,0.4236942004961853,4.51417004048583e-05,0.726916735366859,0.5865736747734263,sadness,0.2714285714285714
