,artist_name,track_name,release_date,genre,lyrics,len,dating,violence,world/life,night/time,shake the audience,family/gospel,romantic,communication,obscene,music,movement/places,light/visual perceptions,family/spiritual,like/girls,sadness,feelings,danceability,loudness,acousticness,instrumentalness,valence,energy,topic,age
402,perry como,between the devil and the deep blue sea,1958,pop,want hate lose devil deep blue forgive cause forget devil deep blue ought cross list come knockin door fate heart twist runnin hate guess devil deep blue instrumental bridge devil deep blue instrumental bridge devil deep blue ought cross list come knockin door fate heart twist runnin hate guess devil deep blue devil deep blue deep blue revue rhythmmania,59,0.0010526316501929,0.4218992157646962,0.0010526316479403,0.0010526315896763,0.0010526315840898,0.0010526315815802,0.0010526315854403,0.0010526316770694,0.0010526316208753,0.187561779560084,0.0010526316127797,0.001052631598909,0.00105263158174,0.001052631587682,0.1955678501631301,0.0010526315807192,0.6458355897324813,0.594441453221547,0.8965862415524515,1.1740890688259108e-06,0.6908491343775762,0.2302061886217067,violence,0.8857142857142857
631,johnny mathis,stairway to the sea (scalinatella),1959,pop,deep night climb stairway pretend close watch stairway mist softly kiss lovers hide voice keep call lonely prisoner stairway wait return till memories burn pray stairway soon whisper wait return till memories burn pray stairway soon whisper,37,0.0017543859704373,0.001754386047184,0.0017543860650662,0.0017543861406319,0.0017543859649124,0.0017543861488334,0.1339761297022629,0.0017543859916513,0.0017543859779702,0.1481723226482835,0.0017543859888368,0.3912303261871793,0.0017543860247241,0.0017543859695354,0.3003054312589638,0.0017543859652598,0.2256038124120004,0.6995359331333486,0.712851117320399,0.0,0.4280708985985161,0.5004849000289098,sadness,0.8714285714285714
645,ira ironstrings,let it snow! let it snow! let it snow!,1959,pop,want want walk floor mobile home feel like home leave tell come home forgive forget tire sleep freeze cold baby aren cool wait ponderosa trailer wasn apart break heart double wide double wide double wide paradise come double wide paradise double wide double wide paradise buy swim pool sear fill tear happiness matter cause treasure world mean aren girl inside castle size blue wait baby feel know leave porch light come home second honeymoon throw rib barbecue like,78,0.1052906939442303,0.0009398497024384,0.0860061483650367,0.0419753696685683,0.0009398496276533,0.0009398496373015,0.0009398496375358,0.0009398497208539,0.0009398496738487,0.116844507385788,0.0571485085607637,0.04890978857413,0.0009398496335208,0.0687322252099167,0.3848072404920568,0.0009398496998508,0.3739846203834074,0.5168320385611362,0.3192764249763303,0.92914979757085,0.9587798845836768,0.4053868349041531,sadness,0.8714285714285714
1350,harry belafonte,land of the sea and sun,1961,pop,nights memories score think nights spend girl go days go land ocean bout bajin girl thoughts motion heart whirl go days go land leave nothings think pull ancor go go days go land go days go land,37,0.0016447368570009,0.0016447369063513,0.3145418827152957,0.0016447369005417,0.001644736849371,0.0016447368487964,0.001644736867411,0.0016447369968812,0.0552277185519591,0.0016447368888372,0.0016447369564413,0.0016447369066417,0.1266447368293639,0.0728031504306543,0.0984458156703053,0.2739967189657192,0.67507852269035,0.4174807066123117,0.9548192317462166,0.0002945344129554,0.6197444352844187,0.1000719942404607,world/life,0.8428571428571429
2005,the beach boys,lonely sea,1963,pop,lonely lonely stop move oooooooooooo oooooooooooo stay oooooooooooo stay oooooooooooo pain heart ooooooooo tear eye ooooooooo tell truth ooooooooo like lonely lonely lonely lonely lonely lonely lonely,27,0.0025062656979531,0.0025062658016449,0.0025062657136831,0.0025062657283505,0.0025062656653733,0.0025062656830782,0.0025062657073148,0.0481137860992253,0.002506265763124,0.0025062656943446,0.0025062657086826,0.0025062657312117,0.0025062656719878,0.0025062659812839,0.8139779349875295,0.0025062656711167,0.0707245748944005,0.4695279850267927,0.7530118002126509,5.050607287449393e-06,0.0781121187139324,0.1130854136785853,sadness,0.8142857142857143
2105,the searchers,sea of heartbreak,1964,pop,light harbor shine like lose ship heartbreak lose loneliness memories caress divine wish dear tear heartbreak lose fail leave sail heartbreak lose loneliness memories caress divine wish dear tear heartbreak sail shore arm come rescue come away heartbreak lose loneliness memories caress divine wish dear tear heartbreak hearbtreak heartbreak heartbreak heartbreak,51,0.0016977931234459,0.0016977929181478,0.0016977929256537,0.0016977928838558,0.0016977928692701,0.0016977928696095,0.1218415492669027,0.0016977928952324,0.0016977929045335,0.0016977929240173,0.0016977928948402,0.271277357094401,0.0016977929011405,0.0016977929854438,0.4705348699363139,0.0016977928718448,0.533196144265136,0.6415916724354536,0.8303211147802358,0.0,0.6259274525968672,0.5305158679630435,sadness,0.8
2195,brenda lee,rockin' around the christmas tree,1964,pop,rockin christmas tree christmas party mistletoe hang couple try stop rockin christmas tree christmas spirit ring later pumpkin carol sentimental feel hear voice sing jolly deck halls boughs rockin christmas tree holiday dance fashion sentimental feel hear voice sing jolly deck halls boughs rockin christmas tree holiday dance fashion,49,0.0022883295213664,0.0022883296011413,0.0022883295444342,0.002288329543743,0.0022883295197241,0.0022883295358386,0.002288329519451,0.0022883297532472,0.084997931368289,0.3666882405210108,0.1563833292449618,0.1462529547423558,0.0967439619698264,0.0022883295389767,0.0022883296388093,0.0834649389475168,0.5711036499512618,0.6898956490526369,0.6164654783789945,0.0,0.9010717230008244,0.4724559966237183,music,0.8
3205,the beach boys,country air,1967,pop,breath country breathe beauty look clear blue come breath country breathe beauty mother nature fill eye breath country breathe beauty rise early sleep ahahhhaaaa ahahhhaaaa ahahhhaaaa,26,0.0022883296218775,0.3722987467911699,0.0022883295878462,0.0022883295657505,0.0022883295227314,0.0022883295611619,0.002288329530559,0.002288329536374,0.002288329535509,0.0022883300497739,0.2495274121705737,0.2956719627691165,0.0481769342684274,0.0022883296731032,0.0022883295878633,0.0022883296378575,0.3035849669663165,0.6795887495833653,0.1676698470580793,0.1568825910931174,0.1364385820280296,0.3042825761925697,violence,0.7571428571428571
4806,albert hammond,the air that i breathe,1972,pop,wish think pass think need cigarettes sleep light sound book read make leave peaceful warm tire leave desire peace come leave weak sleep silent sleep need breathe need breathe need breathe peace come leave weak sleep silent sleep need breathe need breathe need breathe peace come leave weak sleep silent sleep,51,0.0011198209379369,0.4986139868196148,0.0011198208767634,0.0011198209262568,0.1488662462742855,0.0011198208311251,0.001119820884763,0.0011198209726925,0.0011198208637406,0.0011198208914391,0.0011198208788585,0.0612824322222131,0.0783933223126656,0.001119820874704,0.1971665201010953,0.0011198208322628,0.2548467453698689,0.6124400687126631,0.638553853969733,1.771255060728745e-06,0.2477328936521022,0.2322082531506489,violence,0.6857142857142857
4832,roxy music,sea breezes,1972,pop,think long time separate shame think yesterday shame shame shame run round present state hop help come angels mistake lonely life hard word lonely make thoughttrain motion wheel express emotion track crack run round present state hop help come angels mistake,41,0.0015037595203931,0.0015037595377215,0.5095392960129812,0.0015037595478477,0.0015037593999116,0.0015037596324414,0.0015037594175332,0.0015037595281269,0.0015037594757601,0.0015037594719397,0.1920393788650142,0.0704711052367322,0.0015037594575709,0.0015037594314747,0.1346642571101959,0.001503759402176,0.3826491931116647,0.6468733174371202,0.554216419896004,0.062246963562753,0.0153544929925803,0.274251608258436,world/life,0.6857142857142857
4860,mott the hoople,sea diver,1972,pop,morning shadow illspent time say time go try hard leave try sleep hours lord wish escape iron veil ride ride ride fail come go die grow like diver lose space sweet say lord wish escape iron veil ride right ride fail,41,0.0014619884001604,0.001461988418465,0.0014619883785051,0.1090418976920488,0.0014619883187347,0.0835496398748486,0.0303748623082919,0.0014619883742091,0.0014619883465847,0.001461988360867,0.3591255306261537,0.0014619884062622,0.0014619883285231,0.0014619884082858,0.3974402322728721,0.0014619884699946,0.2732589624174158,0.6105940568674204,0.4688749687499686,5.5364372469635625e-06,0.1580791426215993,0.2191948337125243,sadness,0.6857142857142857
5115,the hollies,the air that i breathe,1973,pop,wish think pass think anythin need cigarettes sleep light sound book read make leave peaceful warm tire leave desire peace come leave weak sleep silent sleep need breathe need breathe need breathe peace come leave weak sleep silent sleep need breathe need breathe need breathe need breathe need breathe need breathe need breathe,53,0.0010741139307779,0.4966325630452093,0.0010741138980548,0.0010741139275028,0.2269539912844643,0.0010741138583795,0.0010741139180777,0.0463573897211423,0.0010741138817938,0.0010741139158844,0.0010741138976348,0.0611937300463032,0.0483472529231687,0.0010741138952412,0.1065515924173811,0.0010741138594622,0.2266868840030326,0.6342845422147014,0.1375493348888904,9.210526315789474e-06,0.2281533388293487,0.4384208996317,violence,0.6714285714285714
5150,can,bel air,1973,pop,hate story store right start hate come start gown party stay hide come start run shred head come start gown spin spin spin spin alive spin spin spin spin alive spin spin spin spin alive spin spin spin spin alive spin spin spin spin alive spin spin spin spin alive spin alive break break die break wall tonight break tonight die yeah come speed life come wait goal make speed life break walk goal come speed life come wait goal make speed life break walk goal break know speak know wake know spin alive break know speak know wake know spin alive break know speak know wake know spin alive break know speak know wake know spin alive,118,0.0004873294778632,0.305537558188371,0.0390609314864768,0.0554275228127412,0.0102467412138301,0.0004873294372976,0.0004873294372731,0.1085553923317682,0.0004873295188662,0.0004873294424921,0.0004873294668785,0.3345467089814363,0.0004873294384467,0.0004873294491096,0.1407771915472318,0.0004873294496317,0.2331853135492256,0.530292541599364,0.2309229226133761,0.8927125506072875,0.0121599340478153,0.6156036104430889,violence,0.6714285714285714
5205,wings,medley: hold me tight/lazy dynamite/hands of love/power cut,1973,pop,hold tight wait life hold tight care right hold tight hold tight hold tight hugga right hold tight squeeza tight hold tight hugga right hold tight hold tight hold tight go tonight candlelight right hold tight hold tight hold tight hold tight right hold tight hold tight right hold tight hold tight hold tight hold tight right hold tight squeeza tight hold tight hugga right hold tight hold tight lazy dynamite lazy dynamite lazy dynamite lazy dynamite lazy dynamite come tonight time right fight feel heart know inside hide fight feel heart lazy dynamite lazy dynamite lazy dynamite lazy dynamite fight feel heart know inside hide fight feel heart lazy dynamite lazy dynamite lazy dynamite lazy dynamite hand fall hand imagine fall head heal night know time dream fall hand fall hand night know time dream fall hand fall hand sweet night know time dream fall hand fall hand sweet power powercut candle burn inside say news tell baby know miracle baby baby baby baby baby baby tell baby know miracle baby baby baby baby baby baby baby,178,0.1411434104062308,0.0611583541296425,0.0003706449871598,0.1460592235755382,0.000370644925218,0.0003706449239481,0.4922534517260337,0.0003706449478527,0.0003706449292344,0.000370644926086,0.0003706449290117,0.0003706449374648,0.0003706449308188,0.0003706449271311,0.1188646045919544,0.0357025714113044,0.404310624932308,0.6275671102222906,0.2730916396502406,0.0,0.3961253091508656,0.4414239964251135,romantic,0.6714285714285714
6487,the modern lovers,ice cream man,1977,pop,everybody modern lovers gonna sing cream cream street hear truck outside neat cream block little chime reel cream ring play music learn cream ring chime afternoon fine cream street hear truck today aneat aneat aneat cream block chime chime reel cream street little truck know aneat neat cream block hear chime know reel cream street little truck know aneat aneat aneat cream block chime chime reel cream street hear truck today neat neat cream ring chime afternoon fine time cream ring play music learn cream ring chime afternoon fine,89,0.00111982085831,0.0011198208452918,0.0424940710672992,0.0011198209493958,0.0011198209144695,0.0562323574953854,0.0011198209220501,0.0011198209708087,0.0011198209166111,0.3315303504364326,0.530314039886661,0.0011198208512271,0.0011198208302779,0.0011198209154606,0.001119820862958,0.0011198208418466,0.5191162135817179,0.4519139553367689,0.7068270148865613,7.459514170040485e-05,0.4558944765045342,0.3623424475318949,music,0.6142857142857143
8097,pat benatar,fire and ice,1981,pop,give fever tonight wanna play forget see work straight leave cry see burn come like flame turn cold shoulder wanna little piece heart tear apart move kill tonight advantage light pretty fade away cause illusion passion play see burn come like flame turn cold shoulder wanna little piece heart think figure expert field doubt know methods inside take come like flame turn cold shoulder wanna little piece heart come like flame turn cold shoulder wanna little piece heart come like flame turn cold shoulder come like flame turn cold shoulder,90,0.0394984498552833,0.0984473062780837,0.0006191950670818,0.0279019220754426,0.0006191950495221,0.0612099705313147,0.0006191950560424,0.0006191950833661,0.0006191950854348,0.0006191950845268,0.0006191950733923,0.2583757048362842,0.000619195048821,0.0982281405730554,0.348131372522806,0.0006191950476735,0.7281490306509262,0.6637694536317719,0.1054207885750889,0.0006285425101214,0.6753915910964551,0.478462190210545,sadness,0.5571428571428572
8223,modern english,after the snow,1982,pop,rhythm rain give beat window pane like cry beauty snow beauty snow temperature drop rapidly normal service shortly resume beauty snow beauty snow snow stand watch dark rise glare sunlight eye think time go laugh aloud crimson snow snow snow snow snow bear snow bear snow bear snow bear snow snow rhythm rain give offbeat window pane like cry beauty snow beauty,62,0.0010526315827664,0.0010526316360224,0.0588032740982338,0.0010526317278819,0.0010526315797503,0.0010526315923498,0.0010526315878148,0.0010526317225655,0.0010526316608925,0.3325004957050867,0.0010526316305437,0.3854430637645768,0.0900238061309654,0.0010526316939461,0.0571522556866849,0.0010526316439874,0.591682010180873,0.6071071456041842,0.0067861513917182,0.2419028340080971,0.8000824402308326,0.6316201266746269,music,0.5428571428571428
8829,modern english,hands across the sea,1984,pop,come close eye touch greet reach stretch hand come close eye touch meet reach stretch hand sit room hear call thousand away mean hurt take surprise close eye oooooh lady come close eye touch greet reach stretch hand come close eye touch meet reach stretch hand explain feel begin close eye,51,0.0827936853650353,0.0011695906977434,0.0011695906806192,0.0011695906550713,0.0011695906439766,0.001169590647013,0.3005319399706886,0.0011695907766633,0.001169590667406,0.0461513299083972,0.0011695907020888,0.4341919091474152,0.001169590665029,0.0011695906711914,0.1199568661159761,0.0011695907394659,0.6555832340517709,0.5750839678999051,0.0253002262050463,0.0081174089068825,0.6990931574608409,0.5705571585418883,romantic,0.5142857142857142
9423,kate bush,under ice,1985,pop,wonderful white river freeze soul skate fast speed past tree leave little line cut little line split split sound silver heel spit spit snow move move water try cold water help,31,0.0022883295439709,0.3532103137586427,0.0022883295970435,0.0022883296895076,0.0022883295198235,0.1344147076245395,0.002288329527068,0.0022883296473686,0.0022883295613106,0.0022883297651607,0.002288329675766,0.1292762627370934,0.0022883296353837,0.002288329521291,0.0022883297064447,0.0022883295201831,0.4931224953969457,0.3767146116965361,0.8062247050448846,0.0,0.0650247320692497,0.0458160455061259,violence,0.5
9576,billy bragg,there is power in a union,1986,pop,power factory power land power hand worker amount stand power union lessons past learn workers blood mistake boss cities farmlands trench boss union forever defend right blackleg workers unite brothers sisters land power union long morning realize brutality unjust laws defeat defend workers organize boss send lackies cheat money speak money devil come speak skin bone comfort widow light child power union union forever defend right blackleg workers unite brothers sisters stand power union,74,0.0014224751690433,0.3162278331335479,0.0755676451015507,0.1329184106135936,0.0014224751123687,0.0014224751311128,0.0014224751439546,0.0014224751742475,0.065912387022228,0.0014224751388063,0.0014224751723433,0.0014224753752534,0.2238735819362649,0.0014224751119249,0.0014224751657903,0.0014224752626669,0.4216397703888228,0.7757095608030151,0.3584330907962759,1.2753036437246965e-06,0.546578730420445,0.5375230938143414,violence,0.4857142857142857
9730,john farnham,break the ice,1986,pop,freeze silence face gotta cool think stone game will playin nerve steel balance edge feel gonna night gotta feel right skin cuttin like knife ready break feel like time stand aim right heart ready spill right break inside single mind passion solitary stand think leave cold givin gonna night fall prepare lose fight ready break feel like time stand aim right heart ready spill right break ready break feel like time stand aim right heart ready spill ready break feel like time stand aim right heart ready spill ready break,90,0.0007209805352422,0.1526434268144207,0.0007209805443021,0.3430902877029569,0.0007209805383953,0.0007209805351811,0.0007209805395571,0.0007209805613383,0.0282154597724137,0.0007209805496129,0.0007209805456734,0.0007209805447361,0.0007209805360692,0.0675961627548885,0.267832378115537,0.0579206558288009,0.4822917794866241,0.7717867856318744,0.0403604822896408,0.0,0.5805853256389119,0.9149122575199544,night/time,0.4857142857142857
9734,"10,000 maniacs",cherry tree,1987,pop,shoulder mind eye fall magazine watch wonder face change line read line circle mystery pull apple taste wonderful pride read save life ashamed live silence afraid speak life darkness read line circle mystery pull apple taste wonderful wouldn need eye guide make humble green learn line circle frighten fear trample reach fall pick slowly devour book tower knowledge,58,0.00119617225574,0.6038377975963005,0.2176855143428901,0.0011961723335759,0.0011961724792465,0.0011961722663041,0.0011961722823897,0.0011961723746039,0.001196172283302,0.001196172265288,0.0011961723385685,0.1593379312743648,0.0011961722565979,0.0011961723035757,0.001196172329595,0.0011961722511619,0.5884327954077765,0.5087044586313874,0.0069467941232872,5.961538461538462e-06,0.84439406430338,0.6065943200628487,violence,0.4714285714285714
10123,edie brickell & new bohemians,air of december,1988,pop,thursday afternoon cast round room breeze move curtain lift perfume dance lazy curl hair like pink champagne glisten eye remember chill face like december swear remember swear remember swear remember stand lake want grant grass high water mirror tiny sparkle remember chill face like december swear remember swear remember swear remember bymyself mornings bird windchime treelimbs crackle climb like pink champagne glisten eye remember chill face like december swear remember swear remember swear remember,74,0.001052631587956,0.0010526316587158,0.3205042179681648,0.0010526315917549,0.0010526315808531,0.0010526315810789,0.0010526315890204,0.0010526316376751,0.0010526316377752,0.0010526316180834,0.0010526316534869,0.3066065062471346,0.0010526315874108,0.3360471699310815,0.0010526316278768,0.0010526315793589,0.6837430954186072,0.5227290208445503,0.6164654783789945,0.0,0.1436521022258862,0.3122908343083387,world/life,0.4571428571428571
10522,dionne warwick,love power,1989,pop,psychic tell know true tell get say call turn walk away look girl night try light hold arm know tell hadn get wonder call mistake look late talkin power rule take fool take power take get hopin like walk away uhhuh look mmmhmm mistake power rule take fool take power rule mistake power rule take fool take power rule get hopin like walk away walk away ohwhoa look oohmmm mistake power rule take fool take power rule get,78,0.0007412898514957,0.0007412898754283,0.0007412898795427,0.0007412899445569,0.0007412898460412,0.0007412898493213,0.0007412899033655,0.1749300868945935,0.0297021984728612,0.0007412898750869,0.0007412898932792,0.0350173517813756,0.0007412898997191,0.0702934030220865,0.5660629547103835,0.0007412898481642,0.7779703238384058,0.5763146424634003,0.2499992469871957,1.6194331983805668e-05,0.6125309150865622,0.4814652870039584,sadness,0.4428571428571428
11034,green day,dry ice,1991,pop,late night dream fly hand hand wake cold sweat wish pray tear leave face cry dream understand want friend send letter girl ask write wrong song right love word straight lips need forever dream understand want friend dream understand want friend come ease pain heart come ease pain heart come ease pain heart come ease pain heart late night dream fly hand hand wake cold sweat wish pray tear leave face cry dream understand want friend dream understand want friend dream understand want friend come ease pain heart come ease pain heart come ease pain heart come ease pain heart,100,0.0792509403159893,0.0559356047883264,0.0005211047688543,0.0496413054300109,0.0005211047592785,0.0005211047594942,0.0933856754608626,0.1414953839229045,0.0005211047602225,0.044286345904818,0.0005211047637866,0.0319965029909519,0.0005211047968551,0.0005211048602284,0.4014792122561053,0.0005211047556533,0.184447091952778,0.8338589339281594,0.0024789181515242,0.0,0.2745259686727123,0.9939938064131733,sadness,0.4142857142857143
11685,boyz ii men,let it snow,1993,pop,snow snow snow snow christmas holiday thing angels sing cause thing slip away outside rain sleet body meet care bout weather snow snow outside cold blazin baby snow snow snow snow ohhhh come help trim tree wanna wrap baby present need wait store precious gladly place ohhh come little closer send heaven snow snow outside cold blazin baby snow snow snow snow snow snow snow snow care bout weather baby long,71,0.1356238563837034,0.0008628128189285,0.0008628127992274,0.0008628128509222,0.0008628129424368,0.0491566517992659,0.0008628128141999,0.0008628128331403,0.0792554472287541,0.6132370565546474,0.0008628128350987,0.0593774089055128,0.0008628128068981,0.0008628128034786,0.0008628128760252,0.0008628127771566,0.688075381782736,0.6243109504397097,0.7218872709711558,2.6214574898785424e-05,0.5507007419620774,0.4153971575488643,music,0.3857142857142857
11693,sarah mclachlan,ice cream,1993,pop,better cream better try better cream know fight long long long place start better chocolate better try better chocolate know long long long place start,25,0.0023923445110584,0.0023923445856734,0.002392344626727,0.3509360216844751,0.0023923444994775,0.0023923445228793,0.0023923445100535,0.6083941209182335,0.0023923446995574,0.0023923445449022,0.0023923446197798,0.002392344548912,0.0023923445256077,0.0023923445073965,0.0023923446485122,0.0023923445028365,0.6285064442759667,0.5745968258851883,0.7238953051157683,0.0,0.5043281121187139,0.4103919962265087,night/time,0.3857142857142857
12156,the offspring,nitro (youth energy),1994,pop,generation see world throw live like tomorrow tomorrow tomorrow ones live go know live like tomorrow gonna waste life tomorrow gonna live tomorrow gonna waste life tomorrow gonna live believe official view world change live fast cause understand feel know nitro mean live like tomorrow tomorrow,46,0.0011961722606792,0.0011961723024972,0.7436470302035745,0.0011961722985291,0.0011961722555918,0.0011961722515077,0.0011961722559785,0.0011961724562236,0.0011961723794563,0.0011961722550432,0.0011961723491596,0.0011961722668834,0.0011961722706855,0.077344400658384,0.0011961723644535,0.0335853197903326,0.2819235351456731,0.7513268210137681,0.000816265879785,0.0,0.7619538334707338,0.902899870346301,world/life,0.3714285714285714
